{
  "request_id": "req_20261020_000123",
  "org_id": "org_001",
  "user_id": "user_001",
  "session_id": "sess_01JAB3K9Q2",
  "prompt": "Patient [PATIENT_NAME_1] NIC [NIC_1], review P0012",
  "c1_metadata": {
    "masking_percentage": 47.1,
    "entity_counts": {
      "PATIENT_NAME": 1,
      "NIC": 1
    },
    "reid_level": "Low",
    "placeholder_manifest": [
      "[PATIENT_NAME_1]",
      "[NIC_1]"
    ]
  }
}